{
  "source": "linkedin",
  "source_url": "https://www.linkedin.com/jobs/view/4427557317/",
  "added_at": "2026-07-06",
  "salary": "unknown",
  "relocation": "NO",
  "pros": "Strong Java backend match; remote Ukraine; microservices, cloud and messaging stack.",
  "cons": "Very broad senior requirements including Java, Go and Kotlin.",
  "notes": "",
  "languages": [
    {
      "name": "English",
      "level": "B2",
      "level_rank": 4,
      "raw_value": "Upper-Intermediate English"
    }
  ],
  "technologies": [
    {
      "name": "Java",
      "requirement": "required",
      "level": "master",
      "level_rank": 5,
      "raw_value": "5+ years Java"
    },
    {
      "name": "Spring Boot",
      "requirement": "required",
      "level": "advanced",
      "level_rank": 4,
      "raw_value": "Spring Boot: advanced"
    },
    {
      "name": "Kotlin",
      "requirement": "required",
      "level": "regular",
      "level_rank": 3,
      "raw_value": "Kotlin: regular"
    },
    {
      "name": "Golang",
      "requirement": "required",
      "level": "advanced",
      "level_rank": 4,
      "raw_value": "Golang: advanced"
    },
    {
      "name": "REST API",
      "requirement": "required",
      "level": "advanced",
      "level_rank": 4,
      "raw_value": "REST API: advanced"
    },
    {
      "name": "Microservices",
      "requirement": "required",
      "level": "advanced",
      "level_rank": 4,
      "raw_value": "Microservices: advanced"
    },
    {
      "name": "Event-driven architecture",
      "requirement": "required",
      "level": "advanced",
      "level_rank": 4,
      "raw_value": "Event-driven architecture: advanced"
    },
    {
      "name": "Docker",
      "requirement": "required",
      "level": "regular",
      "level_rank": 3,
      "raw_value": "Docker: regular"
    },
    {
      "name": "SQL/RDBMS",
      "requirement": "required",
      "level": "advanced",
      "level_rank": 4,
      "raw_value": "SQL/RDBMS: advanced"
    },
    {
      "name": "Git",
      "requirement": "required",
      "level": "regular",
      "level_rank": 3,
      "raw_value": "Git: regular"
    },
    {
      "name": "AWS",
      "requirement": "nice_to_have",
      "level": "nice to have",
      "level_rank": 1,
      "raw_value": "AWS: nice to have"
    },
    {
      "name": "Kafka/RabbitMQ/ActiveMQ/SQS/PubSub",
      "requirement": "nice_to_have",
      "level": "nice to have",
      "level_rank": 1,
      "raw_value": "Kafka/RabbitMQ/ActiveMQ/SQS/PubSub: nice to have"
    },
    {
      "name": "Kubernetes",
      "requirement": "nice_to_have",
      "level": "nice to have",
      "level_rank": 1,
      "raw_value": "Kubernetes: nice to have"
    },
    {
      "name": "NoSQL",
      "requirement": "nice_to_have",
      "level": "nice to have",
      "level_rank": 1,
      "raw_value": "NoSQL: nice to have"
    }
  ],
  "title": "Senior Software Engineer (Unique)",
  "company": "Ciklum",
  "location": "Ukraine",
  "remote_type": "remote",
  "remote_scope": "Ukraine",
  "seniority": "senior",
  "role": "backend",
  "summary": "Senior Java backend role for Ciklum with Java, Kotlin, Go, Spring Boot, microservices, event-driven architecture and high-load systems.",
  "candidate_fit_percent": 72,
  "candidate_fit_reason": "Good fit: Java, Spring Boot, REST, microservices and SQL match; gaps are Kotlin/Go and stronger event/cloud/container depth.",
  "job_interest": 780
}
