{
  "source": "linkedin",
  "source_url": "https://www.linkedin.com/jobs/view/4368228123/",
  "added_at": "2026-07-06",
  "salary": "unknown",
  "relocation": "NO",
  "pros": "Java backend; remote; modern cloud/Kubernetes/Spring Boot stack.",
  "cons": "Gaming/entertainment domain; explicit AI-assisted workflow expectation.",
  "notes": "",
  "languages": [
    {
      "name": "English",
      "level": "B2",
      "level_rank": 4,
      "raw_value": "Upper-intermediate or higher level of English"
    }
  ],
  "technologies": [
    {
      "name": "Java",
      "requirement": "required",
      "level": "master",
      "level_rank": 5,
      "raw_value": "extensive production experience with Java"
    },
    {
      "name": "Spring Boot",
      "requirement": "required",
      "level": "advanced",
      "level_rank": 4,
      "raw_value": "latest Java, Spring Boot"
    },
    {
      "name": "PostgreSQL",
      "requirement": "required",
      "level": "advanced",
      "level_rank": 4,
      "raw_value": "PostgreSQL: advanced"
    },
    {
      "name": "Kafka",
      "requirement": "required",
      "level": "advanced",
      "level_rank": 4,
      "raw_value": "Kafka: advanced"
    },
    {
      "name": "GCP",
      "requirement": "required",
      "level": "advanced",
      "level_rank": 4,
      "raw_value": "GCP: advanced"
    },
    {
      "name": "Kubernetes",
      "requirement": "required",
      "level": "advanced",
      "level_rank": 4,
      "raw_value": "Kubernetes: advanced"
    },
    {
      "name": "AI coding assistants",
      "requirement": "required",
      "level": "regular",
      "level_rank": 3,
      "raw_value": "AI coding assistants: regular"
    },
    {
      "name": "System design",
      "requirement": "required",
      "level": "advanced",
      "level_rank": 4,
      "raw_value": "System design: advanced"
    }
  ],
  "title": "Senior Java Engineer",
  "company": "Patrianna",
  "location": "Ukraine",
  "remote_type": "remote",
  "remote_scope": "Ukraine",
  "seniority": "senior",
  "role": "backend",
  "summary": "Senior Java backend role in social gaming/product engineering with Java, Spring Boot, GCP, Kubernetes, PostgreSQL and Kafka.",
  "candidate_fit_percent": 75,
  "candidate_fit_reason": "Good fit: Java, Spring Boot and PostgreSQL match strongly; gaps are GCP/Kubernetes/Kafka depth and AI-assistant requirement.",
  "job_interest": 760
}
